{
  "id": "prenatal-lullaby-first-light",
  "title": "你在海里，听见光",
  "topic": "一段说给肚子里宝宝的温柔低语：他还没见过光，却已经认识了妈妈的心跳、甜味、雨声和爱。",
  "style": "温柔治愈的水彩绘本动画风格，暖米色与淡粉色主调，柔和自然光，圆润线条，细腻颗粒感，安静安眠氛围，孕妇题材亲切安宁，竖屏 9:16 构图",
  "author": "Luna",
  "character": {
    "id": "anan-mom",
    "name": "安安",
    "description": "一位怀孕八个多月的准妈妈，性子安静温和，喜欢在午后对着肚子轻声说话，会把每天的小事讲给还没见面的宝宝听。",
    "visualTraits": "温柔的亚洲年轻女子，黑色长发松松挽成低马尾，几缕碎发落在耳边，杏仁形的深棕色眼睛带着浅浅笑意，素净妆容，神情安宁。",
    "wardrobe": "米白色宽松针织毛衣，浅杏色棉质长裙，光脚或穿米色软拖鞋，手腕上一只细银手镯，所有镜头保持一致。"
  },
  "scenes": [
    {
      "id": "tiny-warm-sea",
      "title": "温暖的小海",
      "narration": "你还没有名字，也没见过光。可你每天都在一片温暖的小海里，轻轻漂着。",
      "imagePrompt": "柔和暖光下的卧室里，怀孕的年轻女子侧坐在窗边，双手轻托隆起的孕肚，低头温柔注视，阳光透过白纱帘洒进来，水彩绘本动画风格，暖米色与淡粉色主调，竖屏构图，单一动作：手轻轻贴在肚子上。",
      "durationInSeconds": 4,
      "subtitle": "你还没有名字，也没见过光。"
    },
    {
      "id": "heartbeat-drum",
      "title": "心跳是小鼓",
      "narration": "那是妈妈的心跳。咚，咚，咚。像深夜里的小鼓，也像很远很远的潮水。",
      "imagePrompt": "夜晚卧室的暖色床头灯下，怀孕的年轻女子靠在枕头上，一只手放在胸口，一只手护着肚子，神情安睡般放松，柔和水彩绘本动画风格，暖米色与淡橘色主调，竖屏构图，单一情绪：安稳的困意。",
      "durationInSeconds": 4,
      "subtitle": "咚，咚，咚——那是妈妈的心跳。"
    },
    {
      "id": "sweet-and-warm",
      "title": "一点甜，一点暖",
      "narration": "妈妈咬一口草莓，你会尝到一点甜；妈妈晒到太阳，你会觉得暖。",
      "imagePrompt": "午后餐桌旁，怀孕的年轻女子手持一颗红草莓微笑，阳光从窗外落在她的肩膀和孕肚上，桌上有一杯温水，清新治愈的水彩绘本动画风格，暖米色与淡粉色主调，竖屏构图，单一动作：把草莓举到嘴边。",
      "durationInSeconds": 4,
      "subtitle": "世界的味道，妈妈先替你尝。"
    },
    {
      "id": "gentle-kick",
      "title": "轻轻踢一下",
      "narration": "有时候妈妈会难过，你就在里面轻轻踢一下，好像在说：别怕，我在这儿。",
      "imagePrompt": "安静的客厅沙发上，怀孕的年轻女子低头看着微微鼓起的肚皮一角，眼里含着笑意与一点泪光，手轻轻覆在那个位置，柔和水彩绘本动画风格，暖灰与淡粉色主调，竖屏近景，单一情绪：被安慰后的释然。",
      "durationInSeconds": 4,
      "subtitle": "别怕，我在这儿。"
    },
    {
      "id": "fathers-hand",
      "title": "爸爸的大手",
      "narration": "爸爸把大手贴在肚子上，你在里面翻了个身，像一朵花慢慢转过来。",
      "imagePrompt": "温馨的家中一隅，一只宽厚的男性手掌轻轻贴在怀孕女子隆起的肚子上，女子把手覆在男子的手背上，两人相视而笑，柔和水彩绘本动画风格，暖橘与米白色主调，竖屏构图，单一动作：两只手叠在肚子上。",
      "durationInSeconds": 4,
      "subtitle": "有人也在等你。"
    },
    {
      "id": "rain-and-sea",
      "title": "雨声里的海",
      "narration": "窗外下雨了，雨点敲着玻璃。你听着听着，就梦见了海。",
      "imagePrompt": "雨天的窗前，怀孕的年轻女子坐在软椅上闭眼休息，窗玻璃上挂着雨珠，窗外是朦胧的灰蓝色雨天，室内暖黄灯光，柔和水彩绘本动画风格，暖黄与灰蓝对比，竖屏构图，单一情绪：听着雨声的宁静睡意。",
      "durationInSeconds": 4,
      "subtitle": "雨点敲窗，你梦见了海。"
    },
    {
      "id": "door-of-light",
      "title": "光做的门",
      "narration": "再等一等，小家伙。等你推开那扇光做的门，我们会第一时间告诉你：欢迎你，我们等了你好久。",
      "imagePrompt": "柔和的金色光芒从一扇发光的门缝里透出，怀孕的年轻女子站在光前低头微笑，双手护着孕肚，光尘在空气中漂浮，温暖治愈的水彩绘本动画风格，金色与暖米色主调，竖屏结尾构图，单一情绪：满怀期待的温柔。",
      "durationInSeconds": 4,
      "subtitle": "欢迎你，我们等了你好久。"
    }
  ]
}
